{
  "schemaVersion": 1,
  "assetKey": "synthetic:asset:1",
  "sourceAssetUrl": "https://example.invalid/source.jpg",
  "sourcePageUrl": null,
  "sourceFilename": "source-aaaaaaaaaaaa.jpg",
  "sourceExtension": ".jpg",
  "sourceMimeType": "image/jpeg",
  "sourceSha256": "aaaaaaaaaaaaaaaaaaaaaaaaaaaaaaaaaaaaaaaaaaaaaaaaaaaaaaaaaaaaaaaa",
  "sourceSizeBytes": 123,
  "sourceAssetKind": "image",
  "role": "gallery",
  "ownerKind": "activity",
  "ownerMigrationKey": "synthetic:activity:1",
  "ownerTitle": "Synthetic activity",
  "ownerYear": 2026,
  "ownerCategory": "regular",
  "historicalDisposition": "migrate",
  "normalizedDisposition": "migrated",
  "targetBucket": "activity-assets",
  "targetStoragePathRedacted": "activity-assets/<redacted>",
  "targetDatabaseReferenceKind": "activity-assets",
  "targetDatabaseReferenceKey": "synthetic:activity:1",
  "duplicateGroup": null,
  "privacyStatus": "private-draft",
  "reviewStatus": "requires-owner-review",
  "evidenceFiles": ["tests/phase13/fixtures/valid/asset.valid.json"],
  "notes": ["Synthetic fixture only."]
}
